{
  "schema_version": 1,
  "exported_at": "2026-05-02T00:00:00Z",
  "source": "Skyrim Potion Cocktails Bridge",
  "character": "Dragonborn",
  "inventory": [
    {
      "name": "Blue Mountain Flower",
      "quantity": 3
    },
    {
      "name": "Wheat",
      "quantity": 2
    }
  ],
  "known_effects": [
    {
      "ingredient": "Blue Mountain Flower",
      "effects": ["Restore Health"]
    },
    {
      "ingredient": "Wheat",
      "effects": ["Restore Health", "Fortify Health"]
    }
  ]
}
